{
  "stage": "PRODUCT_ACCEPTANCE_REVIEW",
  "status": "passed",
  "run_id": "sandbox-2026-04-19-154400-dnnpkaefmlha-v0-1-1-6218cc",
  "archetype": "single_profile_form_fill",
  "wedge": "LeadFill One Profile",
  "target_user": "Sales reps, recruiters, and operators repeatedly entering the same contact details into web forms.",
  "promised_value": "Save one local profile and fill visible lead form fields on the current page in one click.",
  "actual_core_flow": "Popup saves one local profile and the browser smoke fixture verified 5 visible fields filled on a controlled lead-form page.",
  "acceptance_status": "revise",
  "ux_review": {
    "status": "clear_but_basic",
    "notes": "The popup is easy to understand at a glance, but the layout remains utilitarian and lacks stronger guidance for unsupported pages or empty profiles."
  },
  "functionality_review": {
    "status": "happy_path_proven_but_narrow",
    "notes": "The controlled smoke flow passed and filled 5 fields, but the matrix still exposes untested or unsupported real-world controls such as select, readonly, and mixed-state forms."
  },
  "listing_truthfulness_review": {
    "status": "truthful_but_needs_scope_guardrails",
    "notes": "The listing stays close to the one-profile promise, but 'fill visible form fields' is broader than the currently verified support envelope."
  },
  "permissions_review": {
    "status": "minimal",
    "notes": "The current permission set is narrow and aligned with the brief: storage, activeTab, and scripting only."
  },
  "privacy_review": {
    "status": "aligned_with_promise",
    "notes": "No remote sync path is present in popup code, which matches the local-only privacy story."
  },
  "screenshot_review": {
    "status": "real_but_revision_needed",
    "notes": "The screenshots are genuine smoke captures, but they still feel like QA evidence rather than polished proof of user value."
  },
  "biggest_risks": [
    "Current fill logic skips select fields, which weakens real-world lead form usefulness.",
    "Functional coverage is narrow and still anchored to one happy-path fixture.",
    "Field descriptor matching is heuristic and only proven on a single controlled form.",
    "Current screenshots are real but still look like validation assets rather than persuasive user-facing proof."
  ],
  "required_fixes": [
    "Either implement select support or narrow the listing promise to text-style fields only.",
    "Add explicit zero-fill / unsupported-form feedback in the popup.",
    "Define overwrite rules and test them before trusting the extension on partially completed forms.",
    "Add a reset/delete path for the saved profile or document why overwrite-only is acceptable.",
    "Upgrade listing screenshots from smoke-fixture evidence to clearer product-story screenshots."
  ],
  "recommended_decision": "cancel_review_and_revise_before_tester_install",
  "next_step": "manually_cancel_review_then_expand_functional_testing_and_repair",
  "redaction_checks": {
    "sanitized_response_bodies": true,
    "checked_secret_value_count": 0,
    "secret_values_present_in_artifact": false,
    "authorization_header_pattern_present": false,
    "key_material_pattern_present": false,
    "secret_marker_pattern_present": false,
    "redaction_guard_triggered": false
  }
}
